ano,titulo,resumo_pt,abstract_en,autores,orientadores,id_tipo_documento,dc_type_raw,url
2025,O papel da extensão universitária no fomento da inovação social: uma análise da atuação extramuros da Universidade Federal de Santa Catarina,"Esta dissertação tem como objetivo analisar o fomento à inovação social da Universidade Federal de Santa Catarina, a partir do eixo da extensão universitária. A inovação social é compreendida mediante a modificação da dinâmica do sistema que originou o problema. Desta forma, podemos definir a inovação social como qualquer iniciativa, produto, processo, programa ou projeto que desafie e, ao longo do tempo, contribua para a mudança das rotinas com impacto transformador. Nesse sentido, a lente teórica que deu suporte para olhar o caso dessa pesquisa, foi à literatura de inovação social tendo como foco a perspectiva democrática a partir de Moulaert, Maccallum e Hillier (2013). Com a finalidade de cumprir-se o objetivo exposto nessa pesquisa a metodologia pautou-se em um estudo de caso de abordagem qualitativa. Para a etapa da coleta de dados utilizou-se dados primários e secundários, a fim de obter confiabilidade e rigor por meio da triangulação desses dados coletados. Nessa etapa, primeiramente descreveu-se a estrutura e o fluxo das ações de Extensão por meio de análise documental, a partir das resoluções, legislações, regimento interno e cartilha da Pró Reitoria de Extensão (PROEX), e observação não participante no 53º Fórum de Pró-Reitores de Extensão das Instituições Públicas de Educação Superior Brasileira (FORPROEX). Na sequência, o mapeamento das ações de extensão com foco na inovação social, para o mapeamento foi adotado, pelo menos, duas fontes: catálogo de extensão da Pró Reitoria de Extensão e os Editais do Departamento de Inovação da Universidade Federal de Santa Catarina (SINOVA) com fim específico em empreendedorismo e inovação social. E por fim, a compreensão da percepção dos coordenadores de ações de extensão sobre o fomento da Universidade à inovação social, por meio de entrevista semiestruturada com sete coordenadores de ação de extensão tendo como critérios: a tramitação, infraestrutura, financiamento, reconhecimento, rede e política institucional. Portanto, a partir da perspectiva dos coordenadores das ações de extensão, concluiu-se que, a falta de orientação da Universidade Federal de Santa Catarina (UFSC) impacta negativamente o suporte demandado pelos coordenadores. Considerando que a universidade desempenha um papel fundamental no ecossistema de inovação social, seu suporte por meio de políticas mais claras sobre inovação social fortalece esses espaços, promovendo uma sociedade mais justa por meio da transformação social. Ao investir na estruturação de políticas e na promoção de um ambiente mais favorável à inovação social, a universidade pode fortalecer sua contribuição para a sociedade, promovendo não apenas a produção e a disseminação do conhecimento, mas também, o enfrentamento dos desafios sociais contemporâneos. Nesse sentido, os apontamentos feitos pelos coordenadores de extensão são valiosos para orientar transformações institucionais que tornem essas ações mais efetivas e sustentáveis a longo prazo.","Abstract: This dissertation aims to analyze the promotion of social innovation at the Federal University of Santa Catarina, from the perspective of university extension. Social innovation is understood through the modification of the dynamics of the system that originated the problem. Thus, we can define social innovation as any initiative, product, process, program or project that challenges and, over time, contributes to changing routines with a transformative impact. In this sense, the theoretical lens that supported the case study of this research was the literature on social innovation, focusing on the democratic perspective of Moulaert, Maccallum and Hillier (2013). In order to fulfill the objective set out in this research, the methodology was based on a case study with a qualitative approach. For the data collection stage, primary and secondary data were used in order to obtain reliability and rigor through the triangulation of the collected data. At this stage, the structure and flow of Extension actions were first described through documentary analysis, based on resolutions, legislation, internal regulations and booklet of the Pro-Rectorate of Extension (PROEX), and non-participant observation at the 53rd Forum of Pro-Rectors of Extension of Brazilian Public Higher Education Institutions (FORPROEX). Next, the mapping of extension actions focused on social innovation was carried out using at least two sources: the extension catalog of the Office of the Vice-Rector for Extension and the Notices of the Department of Innovation of the Federal University of Santa Catarina (SINOVA) specifically focused on entrepreneurship and social innovation. Finally, the understanding of the perception of extension action coordinators regarding the University's promotion of social innovation was carried out through a semi-structured interview with seven extension action coordinators, using the following criteria: processing, infrastructure, financing, recognition, network, and institutional policy. Therefore, from the perspective of the extension action coordinators, it was concluded that the lack of guidance from the Federal University of Santa Catarina (UFSC) negatively impacts the support demanded by the coordinators. Considering that universities play a fundamental role in the social innovation ecosystem, their support through clearer policies on social innovation strengthens these spaces, promoting a more just society through social transformation. By investing in structuring policies and promoting an environment more favorable to social innovation, universities can strengthen their contribution to society, promoting not only the production and dissemination of knowledge, but also the confrontation of contemporary social challenges. In this sense, the notes made by extension coordinators are valuable for guiding institutional transformations that make these actions more effective and sustainable in the long term.",Daniela Aparecida Walcanaia,Helena Kuerten de Salles,1,Dissertação (Mestrado),https://repositorio.ufsc.br/handle/123456789/265314
2025,Antecedentes e consequentes da experiência de compra no varejo omnichannel: um estudo acerca da jornada de compra do consumidor,"A experiência de compra tornou-se um fator de extrema importância nos estudos de consumo ao longo das últimas quatro décadas. Ela auxilia as organizações no entendimento do comportamento dos consumidores enquanto interagem com as empresas. Vale destacar que, esse comportamento é influenciado e estimulado por ações empresariais que impactam diretamente o consumidor e geram consequências que seguirão afetando-o após sua experiência de compra. Desse modo, os fatores estimulantes somados à própria experiência de compra e seus reflexos pós-compra, formam a jornada do cliente. A jornada do cliente é uma forma de entender os caminhos que o consumidor atravessa, desde suas ações que antecedem sua compra, até aquelas que são consequências da experiência obtida na etapa de compra. Assim, a estratégia omnichannel possui as características necessárias para mapear a jornada do consumidor, uma vez que ela representa o maior grau de integração dos canais de marketing, visando tornar a jornada e a experiência de compra, um caminho contínuo e ininterrupto. Desse modo, sendo o varejo omnichannel o campo de estudo e a jornada de compra o elemento a mapear o percurso do consumidor, a presente tese teve por objetivo investigar a experiência de compra como tópico central da jornada de compra, indicando fatores antecedentes e consequentes da experiência de compra. Para tanto, o estudo testou empiricamente, por meio de uma investigação quantitativa, com a aplicação de um levantamento via questionário, em uma amostra transversal, de que forma a integração de canais, a conveniência e o empoderamento do consumidor impactam em sua experiência de compra e, de que forma essa experiência impacta em seu nível de engajamento e lealdade, sendo essas relações o modelo conceitual do estudo. A análise dos dados ocorreu por meio de Modelagem de Equações Estruturais com a utilização do software SmartPls 4. Os resultados apontam que ao integrar os canais e ofertar conveniência aos consumidores, eles se sentem empoderados, influenciando positivamente sua experiência de compra que, por sua vez, impacta positivamente no engajamento e na lealdade do consumidor com o varejista. O estudo contribui para a teoria ao avançar no entendimento de como os consumidores comportam-se diante dos fatores estudados, permitindo que estudos futuros investiguem de forma mais específica a influência de cada fator na jornada de compra. Já em relação as organizações, podem utilizar os resultados para melhorar suas estratégias integrativas de canais, fornecendo ainda mais conveniência para os consumidores. Dessa forma, poderão explorar as vantagens de atender um consumidor empoderado, gerando melhores experiências de compra. Assim, o consumidor se mostrará engajado e leal, tornando a atividade empresarial mais lucrativa.","Abstract: The shopping experience has become an extremely important factor in consumer studies over the last four decades. It helps organizations understand consumer behavior as they interact with companies. It is worth noting that this behavior is influenced and stimulated by business actions that directly impact the consumer and generate consequences that will continue to affect them after their shopping experience. Thus, the stimulating factors added to the shopping experience itself and its post-purchase effects form the customer journey. The customer journey is a way of understanding the paths that the consumer takes, from their actions that precede their purchase to those that are consequences of the experience obtained during the purchase stage. Thus, the omnichannel strategy has the necessary characteristics to map the consumer journey, since it represents the greatest degree of integration of marketing channels, aiming to make the shopping journey and experience a continuous and uninterrupted path. Thus, with omnichannel retail as the field of study and the purchasing journey as the element to map the consumer's path, this thesis aimed to investigate the purchasing experience as a central topic of the purchasing journey, indicating antecedent and consequent factors of the purchasing experience. To this end, the study empirically tested, through a quantitative investigation, with the application of a survey via questionnaire, in a cross-sectional sample, how channel integration, convenience and consumer empowerment impact their purchasing experience and how this experience impacts their level of engagement and loyalty, these relationships being the conceptual model of the study. Data analysis was carried out through Structural Equation Modeling using SmartPls 4 software. The results indicate that by integrating channels and offering convenience to consumers, they feel empowered, positively influencing their purchasing experience, which, in turn, positively impacts consumer engagement and loyalty with the retailer. The study contributes to theory by advancing the understanding of how consumers behave in light of the factors studied, allowing future studies to investigate more specifically the influence of each factor on the purchasing journey. Organizations can use the results to improve their integrative channel strategies, providing even more convenience for consumers. In this way, they will be able to explore the advantages of serving an empowered consumer, generating better purchasing experiences. In this way, the consumer will be engaged and loyal, making the business activity more profitable.",Marcelo Lisboa Pereira,Martin de La Martinière Petroll,2,Tese (Doutorado),https://repositorio.ufsc.br/handle/123456789/265312
2025,O enactment do strategizing e o trabalho estratégico: grounded theory em contextos tecnológicos,"A pesquisa em estratégias organizacionais evoluiu de uma visão tradicional e prescritiva, centrada no estrategista e em ferramentas analíticas, para a perspectiva processual, que descreve como a estratégia é formada. Nesta esteira, surgiu a perspectiva da estratégia como prática social, que considera o ?fazer? estratégico por meio da intersecção das práticas, práxis e praticantes a partir do nível micro-organizacional. Para conectar essas perspectivas historicamente posicionadas em diferentes concepções epistemológicas, adotamos a visão ontológica de processo a partir do entendimento do trabalho estratégico como um elemento central socialmente construído, sustentado e transformado por diferentes práticas mobilizadas pelo fazer estratégico na criação de múltiplas realidades em um fluxo não linear e recursivo das atividades que ocorrem no interior da organização e em sua relação com o exterior. O objetivo geral desta tese foi compreender como a mobilização do strategizing transforma o trabalho estratégico no contexto de parques tecnológicos. Para tanto, desenvolvemos uma grounded theory em duas das organizações que formam o ecossistema regional de inovação da região sul do Rio Grande do Sul. A seleção dos parques tecnológicos de Pelotas e Rio Grande obedeceu aos critérios de diversidade de estágios de desenvolvimento, a estrutura integrada do Pelotas Parque Tecnológico, que reúne universidades, incubadoras, empresas incubadas e residentes, e a proximidade do Parque Científico e Tecnológico da Universidade Federal do Rio Grande (Oceantec), com os eixos universitários de ensino, pesquisa e extensão. A coleta de dados ocorreu por meio de entrevistas semiestruturadas, observação não participante e levantamento documental. Em um processo abdutivo de análise, estes dados foram coletados em diferentes momentos a partir do movimento de ida e volta do pesquisador ao campo, os quais foram realizados a partir da conexão de conceitos, discussões com pesquisadores da área e com atores do campo, visando ao desenvolvimento de uma teoria substantiva sustentada pelos dados empíricos. Como principais resultados desta tese, destacamos: (i) o desenvolvimento do trabalho estratégico de forma contínua e recursiva, integrando práticas estratégicas em que se manifestaram elementos normativos, cumprimento de pré-requisitos, estilos de tomada de decisão, formação, expertise e conhecimento dos praticantes e liberdade para quebra de requisitos ou procedimentos ao perceber oportunidades de crescimento; (ii) a articulação de elementos de processo, prática e conteúdo estratégico, evitando escolhas epistemológicas binárias, permitindo uma abordagem integrada como elemento explicativo do strategic work; e (iii) o trabalho estratégico sendo moldado pelo strategizing organizacional por meio da criação de novas realidades (enactment), que orienta o desenvolvimento de novos trabalhos em um fluxo contínuo de evolução e transformação. Como contribuições teóricas desta tese, destacamos: (i) a exploração da dinâmica do relacionamento entre processos e práticas no campo de pesquisa em estratégia; (ii) o apaziguamento entre as perspectivas da estratégia como processo e como prática, visando ao avanço teórico do campo de pesquisa em estratégias organizacionais; e (iii) a teorização do trabalho estratégico por meio da descrição de diferentes práticas estratégicas compostas por elementos interconectados, que transcendem características específicas e permitem a geração de múltiplas realidades. Assim, encontramos que existe um padrão social digital e um padrão social presencial para cada uma das três dimensões do fazer estratégico (temporalidade, materialidade e espacialidade) que em conjunto mobilizam o strategizing e transformam o trabalho estratégico.","Abstract: Research on organizational strategies has evolved from a traditional and prescriptive view, centered on the strategist and analytical tools, to a processual perspective, which describes how strategy is formed. On this treadmill, the perspective of strategy as a social practice emerged, which considers strategic ?doing? through the intersection of practices, praxis, and practitioners from the micro-organizational level. To connect these perspectives historically positioned in different epistemological conceptions, we adopted the ontological view of process based on the understanding of strategic work as a central element socially constructed, sustained, and transformed by different practices that mobilization of strategizing in the creation of multiple realities in a non-linear and recursive flow of activities that occur within the organization and in its relationship with the outside. The goal of this thesis was to understand how the mobilization of strategizing transforms strategic work in the context of technology parks. To this end, we developed a grounded theory in two of the organizations that form the regional innovation ecosystem in the southern region of Rio Grande do Sul. The selection of the technology parks of Pelotas and Rio Grande followed the criteria of diversity of development stages, the integrated structure of the Pelotas Technology Park, which brings together universities, incubators, incubated companies and residents, and the proximity of the Science and Technology Park of the Federal University of Rio Grande (Oceantec), with the university axes of teaching, research and extension. Data collection was carried out through semistructured interviews, non-participant observation and documentary survey. In an abductive process of analysis, these data were collected at different times from the researcher's movement to and from the field, which were carried out based on the connection of concepts, discussions with researchers in the area and with actors in the field, aiming at the development of a substantive theory supported by empirical data. The main results of this thesis include: (i) the development of strategic work in a continuous and recursive manner, integrating strategic practices in which normative elements were manifested, compliance with prerequisites, decision-making styles, training, expertise and knowledge of practitioners and freedom to break requirements or procedures when perceiving opportunities for growth; (ii) the articulation of process, practice and strategic content elements, avoiding binary epistemological choices, allowing an integrated approach as an explanatory element of strategic work; and (iii) strategic work being shaped by organizational strategizing through the creation of new realities (enactment), which guides the development of new work in a continuous flow of evolution and transformation. The theoretical contributions of this thesis include: (i) the exploration of the dynamics of the relationship between processes and practices in the field of strategy research; (ii) the appeasement between the perspectives of strategy as a process and as a practice, aiming at the theoretical advancement of the field of research in organizational strategies; and (iii) the theorization of strategic work through the description of different strategic practices composed of interconnected elements, which transcend specific characteristics and allow the generation of multiple realities. Therefore, we find that there is a digital social pattern and a face-to-face social pattern for each of the three dimensions of strategic doing (temporality, materiality and spatiality) that together mobilize strategizing and transform strategic work.",Felipe Kopp Leite,Rosalia Aldraci Barbosa Lavarda,2,Tese (Doutorado),https://repositorio.ufsc.br/handle/123456789/265228
2025,Uma análise da implementação de práticas de inovação aberta em startups com grandes empresas,"Diante dos desafios e oportunidades trazidos pela necessidade de inovação no ambiente empresarial, as startups têm emergido como parceiros estratégicos para grandes empresas em projetos de inovação aberta. Startups, caracterizadas por sua flexibilidade, criatividade e agilidade, complementam as grandes empresas, que oferecem recursos, infraestrutura e experiência consolidada. Nesse cenário, a presente pesquisa teve como objetivo analisar os desafios, vantagens e estratégias envolvidos na interação entre startups e grandes corporações em processos de inovação aberta, a partir da perspectiva de gestores e especialistas. A pesquisa foi classificada quanto aos objetivos como descritiva e explicativa, sendo de abordagem qualitativa. A estratégia adotada foi o estudo de caso, envolvendo entrevistas semiestruturadas com sete participantes, entre gestores de startups e grandes empresas que participaram de colaborações recentes. As entrevistas foram complementadas por dados secundários disponíveis, e a análise foi conduzida com base na técnica de análise de conteúdo de bardin. Os resultados indicaram que a colaboração entre startups e grandes empresas é um fenômeno desafiador, mas repleto de oportunidades. Entre os desafios identificados, destacamse barreiras culturais, burocracia nas grandes corporações, necessidade de personalização das soluções pelas startups e desigualdade de recursos. Em contrapartida, as vantagens incluem o acesso a recursos tecnológicos e financeiros, a ampliação de mercado, o compartilhamento de riscos e a validação de soluções inovadoras. As interações geralmente seguem uma trajetória que se inicia com a prospecção e identificação de sinergias entre os parceiros, evoluindo para fases de validação e, por fim, para a integração ou investimento em soluções específicas. Grandes empresas buscam principalmente a incorporação de inovações tecnológicas, a expansão de mercado e o fortalecimento da marca, enquanto as startups almejam visibilidade, validação de suas soluções e oportunidade de escala. Este estudo evidencia a importância da confiança, do alinhamento de expectativas e da definição clara dos mecanismos de governança para o sucesso das parcerias em inovação aberta. Os achados também reforçam a relevância do papel das políticas públicas e dos agentes intermediadores na facilitação dessas colaborações. Assim, a pesquisa contribui para um melhor entendimento das dinâmicas entre startups e grandes empresas, apontando caminhos para superar desafios e maximizar os benefícios dessas interações no contexto de inovação aberta.","Abstract: Faced with the challenges and opportunities brought about by the need for innovation in the business environment, startups have emerged as strategic partners for large companies in open innovation projects. Startups, characterized by their flexibility, creativity and agility, complement large companies, which offer resources, infrastructure and consolidated experience. In this scenario, this research aimed to analyze the challenges, advantages and strategies involved in the interaction between startups and large corporations in open innovation processes, from the perspective of managers and experts. The research was classified according to its objectives as descriptive and explanatory, with a qualitative approach. The strategy adopted was the case study, involving semi-structured interviews with seven participants, including managers of startups and large companies that participated in recent collaborations. The interviews were complemented by available secondary data, and the analysis was conducted based on Bardin's content analysis technique. The results indicated that collaboration between startups and large companies is a challenging phenomenon, but full of opportunities. Among the challenges identified, cultural barriers, bureaucracy in large corporations, the need for startups to customize solutions and inequality of resources stand out. On the other hand, the advantages include access to technological and financial resources, market expansion, risk sharing, and validation of innovative solutions. Interactions generally follow a trajectory that begins with prospecting and identifying synergies between partners, evolving into validation phases and, finally, integration or investment in specific solutions. Large companies mainly seek to incorporate technological innovations, market expansion, and brand strengthening, while startups seek visibility, validation of their solutions, and opportunities for scale. This study highlights the importance of trust, alignment of expectations, and clear definition of governance mechanisms for the success of open innovation partnerships. The findings also reinforce the relevance of the role of public policies and intermediary agents in facilitating these collaborations. Thus, the research contributes to a better understanding of the dynamics between startups and large companies, pointing out ways to overcome challenges and maximize the benefits of these interactions in the context of open innovation.",Isabella Vieira Cassemiro Framento,Gabriela Gonçalves Silveira Fiates,1,Dissertação (Mestrado),https://repositorio.ufsc.br/handle/123456789/265223
