ano,titulo,resumo_pt,abstract_en,autores,orientadores,id_tipo_documento,dc_type_raw,url
,,,,,,,,https://repositorio.ufsc.br/handle/123456789/74645
2025,"O ensino em Medicina Veterinária: convergências, divergências e gestão em IES públicas catarinenses","O curso de Medicina Veterinária, de acordo com o Conselho Federal de Medicina Veterinária (CFMV) 2025, foi regulamentado pelo Decreto 23.133. O último censo apresentado pelo respectivo conselho informa da existência de 145,6 mil profissionais regulamentados até novembro de 2020. O referido curso tem passado por constantes transformações, motivadas pelas Diretrizes Curriculares Nacionais e pela crescente demanda por profissionais mais bem preparados para lidar com os desafios da saúde animal, pública e ambiental. Diante das diversas modificações que o afetaram, essa pesquisa teve por objetivo principal mapear convergências e divergências internas na gestão da reestruturação curricular dos cursos de Medicina Veterinária em Instituições de Ensino Superior Públicas Catarinenses, sob a perspectiva dos gestores institucionais. Neste sentido, optou-se por uma abordagem qualitativa, com análise documental e entrevistas semiestruturadas, buscando compreender não apenas o conteúdo dos currículos, mas também os processos institucionais e decisórios envolvidos em sua reformulação. Os resultados evidenciaram que, embora existam elementos em comum entre os cursos ofertados nas IES catarinenses, como a incorporação de disciplinas voltadas à interdisciplinaridade, saúde única e extensão, também foram identificadas disparidades significativas no que tange à infraestrutura, maturidade institucional. O estudo também demonstrou que a atuação dos coordenadores de curso, embora fundamental, se dá predominantemente em uma lógica reativa, voltada à resolução de problemas cotidianos, dificultando sua participação estratégica e envolvimento nos processos de planejamento e inovação pedagógica. No específico, as dificuldades enfrentadas pelos coordenadores incluem resistência dos pares, sobrecarga de trabalho, falta de apoio institucional e entraves burocráticos, fatores que comprometem a efetividade das mudanças curriculares propostas. Como conclusão foram mapeadas as principais convergências observadas se referem à busca por atender às novas Diretrizes Curriculares Nacionais, à valorização da extensão universitária e à tentativa de integração entre teoria e prática. Já as principais divergências dizem respeito à infraestrutura disponível, e à maturidade na gestão dos cursos. A pesquisa permitiu perceber que, apesar da relevância inerente ao papel do coordenador de curso no processo de reestruturação curricular, este se apresentou mais associado à gestão operacional do que à formulação estratégica, o que aponta para a necessidade de revisão das práticas operacionais e estrutura de governança acadêmica nas instituições analisadas.","Abstract: The Veterinary Medicine program, according to the Federal Council of Veterinary Medicine (CFMV, 2025), was regulated by Decree 23.133. The most recent census released by the Council reported the existence of 145,600 licensed professionals as of November 2020. The program has undergone constant transformations, driven by the National Curriculum Guidelines and the growing demand for professionals better prepared to address the challenges of animal, public, and environmental health. In light of the various changes that have affected the field, this research aimed to map internal convergences and divergences in the management of curricular restructuring in Veterinary Medicine programs at public higher education institutions in Santa Catarina, from the perspective of institutional managers. To this end, a qualitative approach was adopted, involving document analysis and semi-structured interviews, seeking to understand not only the curricular content but also the institutional and decisionmaking processes involved in its reformulation. The results revealed that, although common elements exist among the programs offered at public institutions in Santa Catarina such as the incorporation of courses focused on interdisciplinarity, One Health, and extension activities significant disparities were also identified regarding infrastructure and institutional maturity. The study further showed that the role of program coordinators, though fundamental, is predominantly carried out within a reactive logic aimed at solving day-to-day problems, which hinders their strategic participation and involvement in planning and pedagogical innovation processes. Specifically, the difficulties faced by coordinators include peer resistance, work overload, lack of institutional support, and bureaucratic obstacles, all of which compromise the effectiveness of the proposed curricular changes. In conclusion, the main convergences observed refer to efforts to comply with the new National Curriculum Guidelines, the appreciation of university extension, and the attempt to integrate theory and practice. The main divergences, on the other hand, concern the availability of infrastructure and the maturity of course management. The research revealed that, despite the inhert relevance of the coordinator's role in the curricular restructuring process, it is more closely associated with operational management than with strategic formulation, pointing to the need for a revision of operational practices and academic governance structures in the institutions analyzed.",Gisele Lima Luiz,Mário César Barreto Moraes,1,Dissertação (Mestrado),https://repositorio.ufsc.br/handle/123456789/269526
2025,A loja física em tempos digitais: estudo de caso das adaptações estratégicas de duas redes supermercadistas de Santa Catarina,"A presente dissertação, investiga como organizações supermercadistas têm estruturado suas respostas diante das transformações impostas pelo ambiente digital. O objetivo central é compreender de que maneira as lojas físicas, em sua dimensão organizacional, permanecem relevantes e atuam como ativos estratégicos em meio às mudanças no comportamento do consumidor e na dinâmica competitiva do setor. Para tanto, adotou-se uma abordagem qualitativa, de caráter descritivo-explicativo, fundamentada em estudo de casos múltiplos. A coleta de dados ocorreu por meio de entrevistas semiestruturadas com executivos, análise documental e observação direta nas unidades estudadas. Os resultados revelam que a loja física não se limita ao papel de ponto de vendas, mas constitui um espaço de experiências, integração operacional e diferenciação competitiva. Ademais, evidenciou-se que o porte organizacional influencia diretamente as decisões estratégicas e a capacidade de incorporação tecnológica, refletindo-se em distintos arranjos de gestão e relacionamento com os consumidores. Assim, a pesquisa contribui para o entendimento das adaptações estratégicas organizacionais no varejo supermercadista, reforçando a centralidade da loja física em tempos digitais.","Abstract: This dissertation, investigates how supermarket organizations have structured their responses to the transformations imposed by the digital environment. The main objective is to understand how physical stores, in their organizational dimension, remain relevant and act as strategic assets amid changes in consumer behavior and the competitive dynamics of the sector. A qualitative, descriptive-explanatory approach was adopted, based on multiple case studies. Data collection involved semi-structured interviews with executives, documentary analysis, and direct observation in the studied units. The results reveal that the physical store is not limited to the role of a point of sale but constitutes a space for experiences, operational integration, and competitive differentiation. Furthermore, it was found that organizational size directly influences strategic decisions and the capacity for technological incorporation, reflected in different management arrangements and customer relationship practices. Therefore, this research contributes to the understanding of organizational strategic adaptations in supermarket retail, reinforcing the centrality of the physical store in digital times.",Fábio Roberto Kuhn Farias,Marco Antonio de Moraes Ocke,1,Dissertação (Mestrado),https://repositorio.ufsc.br/handle/123456789/269205
2025,O impacto da inovação verde e dos critérios ESG no desempenho financeiro das empresas listadas na B3,"Este estudo abordou a lacuna na literatura brasileira sobre a interação entre inovação verde e critérios ESG (ambiental, social e governança) no desempenho financeiro de empresas listadas na B3 entre 2015 e 2020, com o objetivo de avaliar os efeitos diretos de patentes ambientais e escores ESG, além dos impactos indiretos mediados por investimentos em pesquisa e desenvolvimento, sobre indicadores financeiros como retorno sobre patrimônio líquido, margem de lucro e liquidez corrente. A amostra incluiu cinquenta empresas de diferentes setores, cujos dados foram obtidos de demonstrações contábeis públicas, bases de patentes verdes e agências especializadas em ESG. A metodologia envolveu regressões múltiplas para aferir efeitos diretos e modelagem de equações estruturais para testar mediações entre variáveis, complementada por testes de multicolinearidade (VIF), heterocedasticidade (Breusch?Pagan) e endogeneidade (Hausman) para garantir a validade interna dos resultados. A seleção do período refletiu o amadurecimento das práticas ESG no Brasil e permitiu capturar possíveis evoluções regulatórias e tecnológicas, enquanto a diversificação setorial contribuiu para a generalização dos achados. Os achados apresentaram coeficientes positivos e significativos: 0,15 (p?=?0,013) para escore ESG, 0,28 (p?=?0,002) para patentes verdes e 0,35 (p?=?0,001) para investimento em P&D, enquanto o caminho de mediação explicou 11?% dos efeitos financeiros totais. O modelo registrou coeficiente de determinação de 51?%, indicando que mais da metade da variação na rentabilidade pode ser atribuída a fatores sustentáveis. Os resultados demonstram que a adoção de práticas de inovação verde e de estratégias ESG funciona como alavanca de competitividade e sustentabilidade de longo prazo, fornecendo subsídios para gestores, investidores e formuladores de políticas públicas orientados a promover mercados mais responsáveis e resilientes.","Abstract: This study addressed the gap in Brazilian literature regarding the interaction between green innovation and ESG (environmental, social, and governance) criteria in the financial performance of companies listed on B3 between 2015 and 2020. The objective was to assess the direct effects of environmental patents and ESG scores, as well as the indirect impacts mediated by research and development (R&D) investments, on financial indicators such as return on equity, profit margin, and current liquidity. The sample included fifty companies from different sectors, with data obtained from public financial statements, green patent databases, and specialized ESG agencies. The methodology involved multiple regressions to measure direct effects and structural equation modeling to test mediations between variables, complemented by tests for multicollinearity (VIF), heteroskedasticity (Breusch?Pagan), and endogeneity (Hausman) to ensure internal validity. The selection of the period reflected the maturation of ESG practices in Brazil and allowed for capturing potential regulatory and technological developments, while sectoral diversification contributed to the generalization of findings. The results showed positive and significant coefficients: 0.15 (p = 0.013) for ESG score, 0.28 (p = 0.002) for green patents, and 0.35 (p = 0.001) for R&D investment, while the mediation pathway explained 11% of total financial effects. The model registered a coefficient of determination of 51%, indicating that more than half of profitability variation can be attributed to sustainable factors. The findings demonstrate that adopting green innovation practices and ESG strategies acts as a lever for competitiveness and long-term sustainability, providing guidance for managers, investors, and policymakers oriented toward promoting more responsible and resilient markets.",Arianne Hiran Bispo da Silva,Gabriela Gonçalves Silveira Fiates,1,Dissertação (Mestrado),https://repositorio.ufsc.br/handle/123456789/269162
2025,Estratégias universitárias empreendedoras para o desenvolvimento sustentável regional catarinense,"A presente tese aborda as estratégias universitárias que norteiam os projetos empreendedores e como esses projetos contribuem na criação de empreendimentos inovadores e sustentáveis, avaliando impactos no desenvolvimento sustentável regional, buscando compreender o processo através da percepção dos gestores das universidades e gestores dos projetos empreendedores em relação à estratégia universitária, suas potencialidades e limitações. Tem como objetivos caracterizar as estratégias universitárias que estimulam o empreendedorismo; descrever o impacto para o desenvolvimento sustentável regional do empreendedorismo advindo de estratégias universitárias; identificar as potencialidades e limitações das estratégias universitárias que influenciam na contribuição do empreendedorismo para o desenvolvimento sustentável regional; e propor elementos para um modelo de estratégias universitárias que potencialize a geração de novos empreendimentos que estimulem o desenvolvimento sustentável regional. Para isto, a pesquisa realizada foi classificada como estudo de caso e com abordagem qualitativa. Quanto ao seu delineamento foi categorizada como descritiva e exploratória. A população intencionalmente escolhida foi das Universidades da região norte catarinense UFSC, UDESC E UNIVILLE, sendo os sujeitos da pesquisa os gestores locais e os coordenadores dos projetos empreendedores. Foi utilizada a técnica de análise interpretativa de dados que foram coletados através de entrevistas semiestruturadas. Os resultados mostram elementos para um modelo de estratégias universitárias que apontam para os inúmeros desafios e complexidade de se implementar estratégias universitárias que apoiem com eficiência os projetos empreendedores institucionais e que esses, por sua vez, possam apoiar a criação de empreendimentos que já nasçam com comprometimento socioambiental e possam efetivamente contribuir com o desenvolvimento sustentável regional. O trabalho apresenta uma pesquisa inserida no recorte envolvendo os entrevistados que compõem a tríplice hélice do ecossistema de empreendedorismo inovador e sustentável regional, sendo analisados os temas estratégia universitária e educação empreendedora, relacionados com desenvolvimento regional e sustentável associados aos objetivos de desenvolvimento sustentável apresentados pela Organização das Nações Unidas, percebendo-se entre os resultados que ainda há um distanciamento entre as pás dessa hélice, conforme os gestores entrevistados. Destaca-se a necessidade de uma maior capacitação dos gestores nos aspectos de cooperação e empreendedorismo inovador e sustentável, bem como um maior envolvimento e aproximação de todos nessa relação, sendo considerada positiva a criação de uma estrutura de gestão do tríplice hélice em cada universidade para fomentar e fortalecer a atuação dos projetos empreendedores, seus respectivos empreendimentos e impactos positivos no desenvolvimento sustentável regional. A pesquisa resultou na proposta de 8 elementos: governança participativa; conexão e parcerias com o ecossistema; formação continuada na educação empreendedora; infraestrutura de apoio; busca de financiamento e apoio técnico; currículos flexíveis e integrados às demandas regionais; fomento aos projetos institucionais de empreendedorismo inovador e sustentável; e a criação de um observatório para avaliação e acompanhamento de projetos de egressos e do desenvolvimento sustentável regional.","Abstract: This thesis addresses the university strategies that guide entrepreneurial projects and how these projects contribute to the creation of innovative and sustainable ventures. It assesses their impact on regional sustainable development, seeking to understand the process through the perceptions of university administrators and entrepreneurial project managers regarding university strategies, their strengths, and limitations. The objectives are to characterize university strategies that stimulate entrepreneurship; describe the impact of entrepreneurship on regional sustainable development stemming from university strategies; identify the strengths and limitations of university strategies that influence entrepreneurship's contribution to regional sustainable development; and propose elements for a model of university strategies that enhance the generation of new ventures that stimulate regional sustainable development. To this end, the research was classified as a case study with a qualitative approach. Its design was categorized as descriptive and exploratory. The intentionally selected population was from the universities of the northern region of Santa Catarina (UFSC, UDESC, and UNIVILLE), with the research subjects being local administrators and coordinators of entrepreneurial projects. Interpretive analysis of data collected through semi-structured interviews was used. The results reveal elements for a model of university strategies that highlight the numerous challenges and complexities of implementing university strategies that effectively support institutional entrepreneurial projects. These strategies, in turn, can support the creation of ventures that are born with a socio-environmental commitment and can effectively contribute to regional sustainable development. The study presents a survey involving interviewees who make up the triple helix of the regional innovative and sustainable entrepreneurship ecosystem. The topics of university strategy and entrepreneurial education are analyzed, as they relate to regional and sustainable development, linked to the United Nations' Sustainable Development Goals. The results reveal that, according to the interviewees, there is still a gap between the blades of this helix. The need for greater training of managers in aspects of cooperation and innovative and sustainable entrepreneurship is highlighted, as well as greater involvement and engagement of all in this relationship. The creation of a triple helix management structure at each university is considered positive to foster and strengthen the performance of entrepreneurial projects, their respective ventures, and their positive impact on regional sustainable development. The research resulted in the proposal of eight elements: participatory governance; connection and partnerships with the ecosystem; continuing education in entrepreneurial education; support infrastructure; seeking financing and technical support; flexible curricula integrated with regional demands; fostering institutional projects of innovative and sustainable entrepreneurship; and the creation of an observatory to evaluate and monitor alumni projects and regional sustainable development.",João Alceu Ramos Beltrão,Pedro Antônio de Melo,2,Tese (Doutorado),https://repositorio.ufsc.br/handle/123456789/267744
2025,Plant based alternativos à carne: análise dos fatores que influenciam a intenção de compra,"Nas décadas dos anos 2000 a 2020, os produtos plant-based alternativos à carne têm ganhado crescente popularidade, impulsionados pelo aumento do número de consumidores que adotam dietas que reduzem ou excluem alimentos de origem animal. Esse movimento reflete não apenas preocupações éticas e ambientais, mas também o reconhecimento dos benefícios associados a essas dietas para a saúde individual. Apesar do avanço desse mercado e do aumento no número de estudos voltados a ele, ainda existem lacunas teóricas, especialmente no que diz respeito à influência de fatores situacionais e de marketing na intenção de compra desses produtos. Diante desse cenário, esta pesquisa teve como objetivo investigar os fatores que influenciam a intenção de compra de alimentos plant-based alternativos à carne, contribuindo para o aprofundamento do conhecimento sobre sua comercialização e consumo. Para tanto, foi conduzida uma pesquisa qualitativa de caráter exploratório, utilizando grupos focais como técnica de coleta de dados e análise temática como método de interpretação. Foram realizados três grupos focais, cada um com quatro participantes, com composição equilibrada em termos de gênero e predominância do público feminino. Durante as sessões, os participantes foram estimulados a compartilhar percepções, experiências e opiniões sobre diferentes aspectos do consumo de alimentos plant-based. Os resultados evidenciam que a intenção de compra é influenciada por uma combinação de fatores socioculturais, pessoais, psicológicos, situacionais e, de forma destacada, de marketing ? como preço, embalagem e estratégias de comunicação. A pesquisa contribui para ampliar o entendimento sobre os desafios e oportunidades enfrentados pelas marcas nesse segmento, oferecendo subsídios para o desenvolvimento de estratégias mais eficazes de posicionamento e engajamento do consumidor.","Abstract: In recent decades, plant-based meat alternatives have gained increasing popularity, driven by the growing number of consumers adopting diets that reduce or eliminate animal-based products. This shift reflects not only ethical and environmental concerns but also a recognition of the health benefits associated with such diets. Despite the growth of this market and the expansion of related studies, theoretical gaps remain ? particularly regarding the influence of situational and marketing factors on the consumption of plant-based foods. In this context, the present research aimed to investigate the factors that influence the purchase intention of plant-based meat alternatives, contributing to a deeper understanding of their commercialization and consumption. A qualitative exploratory approach was adopted, using focus groups as the primary data collection technique and thematic analysis as the analytical method. Three focus groups were conducted, each composed of four participants, with a gender-balanced composition and a majority of female participants. During the sessions, participants were encouraged to share their perceptions, experiences, and opinions on various aspects of plant-based food consumption. The findings reveal that purchase intention is influenced by a combination of sociocultural, personal, psychological, situational, and notably, marketing factors ? such as price, packaging, and communication strategies. This research offers valuable insights into the challenges and opportunities faced by brands in this segment, providing support for the development of more effective consumer engagement and positioning strategies.",Lyza Pereira,Marco Antonio de Moraes Ocke,1,Dissertação (Mestrado),https://repositorio.ufsc.br/handle/123456789/267740
