ano,titulo,resumo_pt,abstract_en,autores,orientadores,id_tipo_documento,dc_type_raw,url
2024,Sistema agroindustrial do café no sul do estado do Espírito Santo: um estudo sob a perspectiva da nova economia institucional,"Os pequenos cafeicultores do Sul do estado do Espírito Santo têm enfrentado diversas dificuldades econômicas e operacionais. Uma das razões para isso é a predominância na região da produção e exportação de café como commodity, o que resulta em menor valor agregado e maior vulnerabilidade às crises de mercado. Os desafios que esses produtores enfrentam incluem a falta de coordenação entre os elos da cadeia produtiva, assimetria de informações, acesso limitado a tecnologias avançadas e a dependência de intermediários para a comercialização dos produtos. Esta tese investiga o sistema agroindustrial de café na região sob a perspectiva da Nova Economia Institucional, com foco nas relações entre fornecedores de insumos, cafeicultores e compradores. O objetivo principal é compreender como os atributos transacionais, as condições de mensuração das dimensões dos ativos e as estruturas de governança existentes afetam essas relações. A metodologia empregada foi qualitativa, utilizando entrevistas estruturadas com atores-chave da cadeia produtiva do café, além de análise de conteúdo para identificar padrões e insights relevantes. Os resultados mostram que a falta de coordenação e a assimetria de informações são desafios significativos e que impactam negativamente a sustentabilidade dos pequenos cafeicultores. A pesquisa identificou estruturas de governança ineficazes e desconfiança na mensuração dos atributos das transações, que são cruciais para melhorar a eficiência e a competitividade do setor. A análise revelou que a frequência das transações, a especificidade dos ativos e as incertezas influenciam significativamente a eficiência das estruturas de governança. A especificidade dos ativos, como a qualidade do café, é fundamental para a precificação e a valorização do produto, o que destaca a vulnerabilidade dos produtores de café commodity em relação aos produtores de cafés especiais. A padronização e a mensuração da qualidade do café são essenciais para garantir uma precificação justa e proteger os direitos de propriedade dos cafeicultores. No entanto, a assimetria de informações entre produtores e compradores agrava a desconfiança e a vulnerabilidade dos cafeicultores. A governança no SAG do café é predominantemente via mercado, com forte presença de acordos informais. Essa estrutura oferece flexibilidade, mas também aumenta as incertezas e riscos de comportamentos oportunistas. A adoção de formas plurais de governança, combinando contratos formais e informais, além da integração vertical, pode proporcionar maior segurança e resiliência, especialmente para os pequenos cafeicultores. Em particular, a adoção de práticas de governança mais transparentes e inclusivas pode reduzir os custos de transação e aumentar a proteção dos direitos de propriedade dos cafeicultores. As conclusões reforçam a necessidade de políticas públicas direcionadas que melhorem a coordenação na cadeia produtiva e incentivem a produção de cafés especiais. A pesquisa sugere também a importância de futuros estudos que explorem a dinâmica de produção de cafés conilon, o desenvolvimento de políticas públicas baseadas nos achados deste estudo e a realização de análises comparativas envolvendo outros países produtores de café.","Abstract: Small coffee producers in the southern region of Espírito Santo state have been facing various economic and operational challenges. One of the reasons for this is the predominance of coffee production and export as a commodity in the region, resulting in lower added value and greater vulnerability to market crises. The challenges these producers face include a lack of coordination among the links in the production chain, information asymmetry, limited access to advanced technologies, and dependence on intermediaries for product commercialization. This thesis investigates the coffee agro-industrial system in the region from the perspective of New Institutional Economics, focusing on the relationships between input suppliers, coffee growers, and buyers. The main objective is to understand how transactional attributes, the measurement conditions of asset dimensions, and existing governance structures affect these relationships. The methodology employed was qualitative, using structured interviews with key actors in the coffee production chain and content analysis to identify relevant patterns and insights. The results show that lack of coordination and information asymmetry are significant challenges that negatively impact the sustainability of small coffee growers. The research identified ineffective governance structures and distrust in the measurement of transaction attributes, which are crucial to improving efficiency and competitiveness in the sector. The analysis revealed that transaction frequency, asset specificity, and uncertainties significantly influence the efficiency of governance structures. Asset specificity, such as coffee quality, is critical for pricing and product valuation, highlighting the vulnerability of commodity coffee producers compared to specialty coffee producers. Standardization and measurement of coffee quality are essential to ensure fair pricing and protect the property rights of coffee growers. However, information asymmetry between producers and buyers exacerbates distrust and the vulnerability of coffee growers. Governance in the coffee agro-industrial system is predominantly market-based, with a strong presence of informal agreements. While this structure provides flexibility, it also increases uncertainties and risks of opportunistic behavior. Adopting plural forms of governance, combining formal and informal contracts, as well as vertical integration, could offer greater security and resilience, particularly for small coffee producers. In particular, adopting more transparent and inclusive governance practices could reduce transaction costs and enhance the protection of coffee growers' property rights. The conclusions reinforce the need for targeted public policies to improve coordination within the production chain and encourage the production of specialty coffees. The research also suggests the importance of future studies exploring the dynamics of conilon coffee production, the development of public policies based on the findings of this study, and comparative analyses involving other coffee-producing countries.",Bruno Fardim Christo,Silvio Antônio Ferraz Cário,2,Tese (Doutorado),https://repositorio.ufsc.br/handle/123456789/263966
2024,Diretrizes de governança pública para adaptação climática local: uma proposta a partir do contexto Brasil-Portugal,"Esta tese tem como objetivo propor diretrizes de governança pública para fortalecer a adaptação climática em nível local. Para isso, foram analisadas as características de governança nos planos de adaptação climática de 14 cidades brasileiras, bem como no caso de Cascais, em Portugal. O estudo adota uma abordagem qualitativa, utilizando dados coletados por meio de documentos, entrevistas, questionários e observações, com aplicação de análise de conteúdo para interpretar os resultados. Os achados revelam que, embora Brasil e Portugal tenham seguido trajetórias distintas na adaptação às mudanças climáticas, ambos enfrentam desafios similares. No Brasil, observou-se uma transição significativa do modelo tradicional de administração pública para uma estrutura de governança mais moderna e inclusiva, caracterizada pela ampliação dos espaços participativos, pela promoção da inovação e do aprendizado, e pela colaboração intersetorial entre o Estado, o mercado e a sociedade civil. Contudo, a dependência de suporte técnico e financeiro externo foi identificada como uma vulnerabilidade, indicando a necessidade de fortalecer as capacidades institucionais locais para assegurar a sustentabilidade das iniciativas de adaptação. Em Cascais, a governança de adaptação climática se destaca pela abordagem estruturada e colaborativa, com avanços significativos na implementação das ações planejadas. A cidade apresenta um modelo robusto de governança, com destaque para a criação de grupos de trabalho temáticos e a utilização de espaços participativos, como workshops e consultas públicas. No entanto, desafios persistem, especialmente no que diz respeito à necessidade de melhorar a transparência, o engajamento público e o monitoramento das ações implementadas. A pesquisa revelou um baixo nível de conhecimento sobre o plano de adaptação entre os atores locais de Cascais, indicando que as estratégias de comunicação e envolvimento social precisam ser reforçadas. Com base nos achados da pesquisa, foram propostas dez diretrizes de governança pública para a adaptação climática em contexto local. As diretrizes enfatizam a importância da criação de unidades de ação climática e de espaços deliberativos, do apoio técnico e científico da academia, da institucionalização do apoio político, da formação de grupos de trabalho temáticos e intersetoriais, da parceria com a sociedade civil e setor privado e da implementação de mecanismos robustos de controle social, accountability, avaliação e capacitação. A pesquisa conclui que o fortalecimento das características da governança pública é essencial para enfrentar os desafios climáticos e promover resiliência e sustentabilidade nas comunidades locais. A tese reconhece suas limitações, como a aplicação das diretrizes propostas em contextos distintos e a dependência de dados disponíveis nos documentos oficiais analisados. Sugere-se que futuras pesquisas avaliem a eficácia dessas diretrizes em diversos contextos, explorem novas tecnologias e metodologias participativas, e enfoquem na melhoria da coordenação intersetorial, da transparência e dos mecanismos de controle social.","Abstract: This thesis aims to propose public governance guidelines to strengthen climate adaptation at the local level. To this end, the governance characteristics in the climate adaptation plans of 14 Brazilian cities, as well as the case of Cascais, Portugal, were analyzed. The study adopts a qualitative approach, using data collected through documents, interviews, questionnaires, and observations, with content analysis applied to interpret the results. The findings reveal that, although Brazil and Portugal have followed different paths in climate adaptation, both face similar challenges. In Brazil, a significant transition from the traditional public administration model to a more modern and inclusive governance structure was observed, characterized by expanded participatory spaces, the promotion of innovation and learning, and cross-sector collaboration among the state, the market, and civil society. However, reliance on external technical and financial support was identified as a vulnerability, indicating the need to strengthen local institutional capacities to ensure the sustainability of adaptation initiatives. In Cascais, climate adaptation governance is marked by a structured and collaborative approach, with significant progress in implementing planned actions. The city demonstrates a robust governance model, highlighted by the creation of thematic working groups and the use of participatory spaces such as workshops and public consultations. Nonetheless, challenges persist, particularly regarding the need to improve transparency, public engagement, and monitoring of implemented actions. The research revealed a low level of awareness about the adaptation plan among local stakeholders in Cascais, indicating that communication and social engagement strategies need to be reinforced. Based on the research findings, ten public governance guidelines were proposed for climate adaptation in local contexts. These guidelines emphasize the importance of creating climate action units and deliberative spaces, technical and scientific support from academia, institutionalizing political support, forming thematic and cross-sector working groups, partnering with civil society and the private sector, and implementing robust mechanisms for social control, accountability, evaluation, and capacity building. The research concludes that strengthening public governance characteristics is essential to address climate challenges and promote resilience and sustainability in local communities. The thesis acknowledges its limitations, such as the application of the proposed guidelines in distinct contexts and the reliance on data available in the analyzed official documents. Future research is suggested to assess the effectiveness of these guidelines in various contexts, explore new technologies and participatory methodologies, and focus on improving cross-sector coordination, transparency, and social control mechanisms.",Bruna Teixeira Adriano,Renê Birochi,2,Tese (Doutorado),https://repositorio.ufsc.br/handle/123456789/263900
2024,Estratégias de internacionalização do currículo em instituições públicas de ensino superior de Santa Catarina,"A internacionalização ganhou destaque no século XXI, principalmente com o avanço da globalização. A internacionalização do currículo é um fenômeno advindo da internacionalização, sendo essencial para que ocorra dentro de cada curso da instituição. Nesse sentido, a internacionalização do currículo parte da premissa que devem ser incluídos alguns valores, atitudes, habilidades, conhecimentos e competências específicas para que o currículo se torne internacional, além de ser necessário ter uma estratégia institucional para tal. Sendo assim, o objetivo dessa pesquisa é analisar o processo de internacionalização do currículo nas instituições públicas de ensino superior de Santa Catarina. Para isso, utilizou-se a filosofia interpretativista, com uma lógica indutiva e uma abordagem qualitativa. Para alcançar os objetivos da pesquisa utilizou se uma metodologia descritiva, com a aplicação de estudo de casos múltiplos, investigando três instituições de ensino superior públicas de Santa Catarina. O horizonte de tempo utilizado foi o transversal e a seleção intencional. A coleta de dados foi realizada por meio da pesquisa documental e de dois modelos de entrevistas semiestruturadas, totalizando quatro entrevistas por instituição objeto de pesquisa. Para analisar os dados recorreu-se a análise temática de Braun e Clarke (2006). Como resultados compreendeu-se que as instituições investigadas ainda não possuem uma estratégia de internacionalização do currículo formuladas, mas já realizam diversas iniciativas e ações que estão inseridas e relacionadas com esse fenômeno. As instituições públicas de ensino superior de Santa Catarina não possuem uma estratégia de internacionalização do currículo e ainda não realizam a de forma plena. Todas as instituições investigadas realizam ações de internacionalização do currículo, principalmente com foco no ensino em línguas estrangeiras. Além disso, todas também disponibilizam o ensino de línguas estrangeiras para seus acadêmicos. Duas delas para toda a comunidade acadêmica e uma delas somente para servidores da instituição. No entanto, percebe-se que algumas delas estão mais avançadas no sentido da internacionalização do currículo plena que outras, visto que duas delas já possuem estratégia de internacionalização que de acordo com o modelo proposto. Trata-se do primeiro passo para iniciar a internacionalização do currículo. Sendo assim, nenhuma das Instituições de Ensino Superior Catarinenses investigadas realiza a internacionalização do currículo de forma plena.","Abstract: Internationalization became prominent in the 21st century, especially with globalization. The curriculum internationalization is a phenomenon that emerges from the internationalization, essential for its occurrence in each institution's courses. Therefore, curriculum internationalization starts from the premise that some specific values, attitudes, skills, knowledge and competences must be included in the curriculum for it to become international, alongside that an institutional strategy of curriculum internationalization must be in place. The aim of this research is to analyze the process of curriculum internationalization in public higher education institutions in Santa Catarina, Brazil. The study was conducted employing an interpretivist philosophy alongside an inductive logic and a qualitative approach. To achieve the research objectives, a descriptive methodology was used with multiple case studies involving three public institutions in Santa Catarina. The time horizon was cross-sectional and was used an intentional selection criteria. The data collection was conducted involving documentary research and two models of semi-structured interviews, totaling four interviews per institution used as research subjects. The data analysis was based in the Braun and Clarke's thematic analysis (2006). Findings reveal there is not na curriculum internationalization strategy present in the higher education institutions studied but they already engaged several initiatives and actions related to the phenomenon. The public higher education institutions of Santa Catarina don?t have a curriculum internationalization and don?t have yet implemented it fully, but they do carry out some curriculum internationalization actions. All the search institutions perform some curriculum internationalization mainly focusing on teaching in foreign languages. In addition, all of them offer foreign language teaching to their academics, and two of them do for the entire academic community and one of them only for the employees. However, it is clear that some institutions are more advanced towards full internationalization of the curriculum than others, as two of them already have an internationalization strategy which, according to the propodes model, os the first step to start internationalizing the curriculum. Therefore, none of the Santa Catarina Higher Education Institutions investigated fully internationalizes the curriculum in the momento of the investigation.",Fernanda Silva Teodoro,Pedro Antônio de Melo,2,Tese (Doutorado),https://repositorio.ufsc.br/handle/123456789/263239
2024,Trabalho e desigualdades: o emprego sem registro formal entre trabalhadores fronteiriços uruguaios na cidade-gêmea de Santana do Livramento/RS,"Este estudo teve como principal objetivo analisar os fenômenos sociais relacionados ao emprego sem o devido registro formal do contrato de trabalho entre trabalhadores fronteiriços uruguaios na cidade brasileira de Santana do Livramento/RS., com a finalidade de compreender as razões pelas quais essas pessoas estão sujeitas a relações de trabalho desiguais. Para tanto, adotou-se a estratégia de pesquisa conhecida como História Oral Temática, privilegiando, desse modo, as experiências de vida das pessoas fronteiriças uruguaias com essa modalidade de trabalho. Agentes institucionais que lidam com as suas demandas também foram ouvidos e outras histórias foram surgindo para enriquecer o debate. Realizou-se, ainda, um levantamento de dados históricos do mercado de trabalho do município e de alguns indicadores de desigualdades, como forma de melhor compreender o contexto do trabalho na região, subsidiando, assim, as análises das narrativas dos trabalhadores e agentes institucionais. As entrevistas semiestruturadas foram submetidas a análise temática de conteúdo (GOMES, 2009). Os resultados indicaram uma classe trabalhadora heterogênea, com diferentes características e demandas. As razões da exploração desse tipo de trabalho na fronteira mostraram-se diversas e envolveram as ações/omissões de diferentes atores da relação ? classe trabalhadora, empresariado e Estado ?, bem como os aspectos sociais, econômicos, culturais e políticos do contexto em que estão inseridos. A pesquisa contribuiu para uma melhor compreensão desse tipo de trabalho atípico (ou ?informal?), suas especificidades, motivações e consequências para os atores da relação de trabalho, sobretudo para a classe trabalhadora. Algumas características pessoais e socioeconômicas das pessoas comumente recrutadas foram identificadas. Mesmo reconhecendo a diversidade de razões que levam à sua prática, o estudo evidenciou que a condição de fronteiriço, especialmente de indocumentado, interseccionada a outros eixos de diferenciação, é uma das causas da exploração de parte dessa força de trabalho. Esses atributos, por diferentes motivos, diminuem significativamente os riscos para os empregadores e, ao mesmo tempo, tornam essas pessoas mais vulneráveis as diferentes formas de desigualdades no trabalho. Constatou-se a premência de políticas públicas de proteção e amparo a essa classe trabalhadora. Algumas foram sugeridas. Para não ficar apenas na identificação do problema social, o estudo apontou algumas estratégias de ação utilizadas por trabalhadores para superação da condição de precariedade. As histórias de vida dessas pessoas revelaram principalmente o investimento na educação, a aquisição de experiência e qualificação profissional e a regularização da situação documental.","Abstract: The main objective of this study was to analyze the social phenomena related to employment without formal registration of the employment contract among Uruguayan border workers in the Brazilian city of Santana do Livramento/RS, to understand why these people are subject to unequal labor relations. To this end, the research strategy known as Thematic Oral History was adopted, privileging the life experiences of Uruguayan border workers with this type of work. Institutional agents who deal with their demands were also heard, and other stories emerged to enrich the debate. A survey of historical data on the city's labor market and some indicators of inequality was also carried out, as a way of better understanding the context of work in the region, thus supporting the analyses of the narratives of workers and institutional agents. The semi-structured interviews were subjected to thematic content analysis (GOMES, 2009). The results indicated a heterogeneous working class, with different characteristics and demands. The reasons for the exploitation of this type of work on the border were diverse and involved the actions/omissions of other actors in the relationship ? the working class, businesspeople, and the State, as well as the social, economic, cultural, and political aspects of the context in which they are inserted. The research contributed to a better understanding of this type of atypical (or informal) work, its specificities, motivations, and consequences for the actors in the employment relationship, especially for the working class. Some of the personal and socioeconomic characteristics of the people commonly recruited were identified. Even recognizing the diversity of reasons that lead to this practice, the study showed that the condition of being a border worker, especially undocumented, intersected with other axes of differentiation, is one of the causes of the exploitation of part of this workforce. These attributes, for different reasons, significantly reduce the risks for employers and, at the same time, make these people more vulnerable to various forms of inequality in the workplace. The study confirmed the urgent need for public policies to protect and support this working class. Some were suggested. In order not to limit itself to identifying the social problem, the study pointed out some action strategies workers use to overcome their precarious conditions. The life stories of these people mainly revealed investment in education, the acquisition of experience and professional qualifications, and the regularization of their document status.",Silvio de Freitas Barboza,Lauro Francisco Mattei,2,Tese (Doutorado),https://repositorio.ufsc.br/handle/123456789/263071
