ano,titulo,resumo_pt,abstract_en,autores,orientadores,id_tipo_documento,dc_type_raw,url
2024,Análise dos atributos que constituem a identidade da marca Florianópolis em relação ao posicionamento Ilha do Silício,"Este estudo tem como objetivo analisar os atributos formadores da identidade da marca Florianópolis presentes na infraestrutura e superestrutura de tecnologia e inovação geridas pela administração pública, empresas, instituições de ensino e publicidade no geral. O contexto foi escolhido devido ao crescente desenvolvimento tecnológico da cidade, assim como o aumento de noticiários, propagandas e eventos que buscam transmitir a marca Florianópolis como uma cidade inteligente/tecnológica. Para atingir esse objetivo, fundamentamos a literatura existente sobre place branding, abordando os conceitos de identidade de marca de lugar, imagem de marca de lugar e posicionamento. Desenvolveu-se uma estrutura analítica para identificar as dimensões relacionadas à tecnologia que podem constituir a identidade da marca Florianópolis, no que se refere ao seu posicionamento como Ilha do Silício. Para realizar a pesquisa, desenvolveu-se uma filosofia de pesquisa interpretativista, utilizando o método qualitativo, sendo aplicado por meio de análises documentais para, a posteriori, realizar uma análise de conteúdo em busca de dimensões que tratam sobre a identidade da marca. Como principais resultados, acordos-se que Desenvolvimento Sustentável Notório, Inovação Tecnológica e Empresarial, Ensino e Impacto Social, Comunidade Tecnológica Colaborativa e Conexões e Eventos foram os principais atributos emergidos com potencial de constituir a identidade da marca Florianópolis no contexto tecnológico.","Abstract: This study aims to analyze the attributes that form the identity of the Florianópolis brand present in the infrastructure and superstructure of technology and innovation managed by public administration, companies, educational institution and publicity in general. The context was chosen due to the city?s growing technological development, as well as the increase in news, advertisements and events that seek to convey the Florianópolis brand as a smart/technological city. To achieve this objective, it was based on the existing literature on place branding, addressing the concepts of place brand identity, place brand image and positioning. An analytical structure was developed to identify the dimensions related to technology that can constitute the identity of the Florianópolis brand, about its positioning as a Silicon Island. To carry out the research, the interpretive research philosophy was adopted, using the qualitative method, being applied through documentary analysis to, a posteriori, carry out a content analysis in search of dimensions that deal with the brand?s identity. As main results, it was identified that Notorious Sustainable Development, Technological and Business Innovation, Education and Social Impact, Collaborative Technological Community and Connections and Events were the main attributes that emerged with the potential to constitute the identity of the Florianópolis brand in the technological context.",Patrick Wendell Barbosa Lessa,Marco Antonio de Moraes Ocke,1,Dissertação (Mestrado),https://repositorio.ufsc.br/handle/123456789/254242
2023,Internacionalização de empresas de base tecnológica: um estudo sobre incubadoras em regiões selecionadas de Santa Catarina,"A presente pesquisa tem como objetivo analisar o processo de internacionalização empreendidos pelas incubadoras de base tecnológicas em regiões selecionadas de Santa Catarina. Para cumprir a finalidade deste estudo, realizou-se pesquisa qualitativa através de entrevista semiestruturada junto a diretores das incubadoras de base tecnológicas ? CELTA (Florianópolis), MIDITEC (Florianópolis), SOFTVILLE (Joinville), INCHTECH (Chapecó), GENE (Blumenau) e ITEC.IN (Criciúma). As questões procuraram focar as dimensões: empreendedores, características organizacionais, network, mercado externo e instituições, inovação e território. Os resultados apontaram que as incubadoras em estudo realizam praticas internacionalizantes com características distintas em cada dimensão. Estando presente a estratégia de internacionalização em todas as incubadoras estudadas, face o desejo de inserção no mercado global. O ranking final das dimensões estudadas colocou a incubadora CELTA em 1º lugar, a incubadora SOFTVILLE em 2º e a incubadora INCHTECH em 3º lugar. A ordem de classificação das demais foi na seguinte ordem decrescente: MIDITEC, GENE e ITEC.IN. Ao identificar as práticas existentes nas incubadoras de empresas, ficaram evidentes implicações internacionalizantes para as incubadoras, como forma de otimizar e implementar novos processos em suas rotinas que visam facilitar a internacionalização das empresas incubadas.","Abstract: This research aims to analyze the internationalization process undertaken by technology-based incubators in selected regions of Santa Catarina. To fulfill the purpose of this study, qualitative research was carried out through semi-structured interviews with directors of technology-based incubators ? CELTA (Florianópolis), MIDITEC (Florianópolis), SOFTVILLE (Joinville), INCHTECH (Chapecó), GENE (Blumenau) and ITEC.IN (Criciúma). The questions sought to focus on the dimensions: entrepreneurs, organizational characteristics, network, external market and institutions, innovation and territory. The results showed that the incubators under study carry out internationalizing practices with distinct characteristics in each dimension. The internationalization strategy is present in all the incubators studied, given the desire to enter the global market. The final ranking of the dimensions studied placed the CELTA incubator in 1st place, the SOFTVILLE incubator in 2nd and the INCHTECH incubator in 3rd place. The classification order of the others was in the following descending order: MIDITEC, GENE and ITEC.IN. By identifying existing practices in business incubators, internationalizing implications for incubators became evident, as a way of optimizing and implementing new processes in their routines that aim to facilitate the internationalization of incubated companies.",Marinês Garcia,Silvio Antônio Ferraz Cário,1,Dissertação (Mestrado),https://repositorio.ufsc.br/handle/123456789/254218
2023,"Comportamento de cocriação de valor on-line, engajamento do consumidor nas redes sociais e a influência na intenção de compra on-line","A presente Tese de Doutorado teve como objetivo verificar se a intenção de compras de alimentos pela internet de restaurantes no Brasil é positivamente afetada pelo comportamento de cocriação de valor on-line dos consumidores. Para responder ao objetivo pesquisa supracitada foi desenvolvida quantitativamente, técnica survey, com amostragem por conveniência composta por 606 entrevistados, no período de fevereiro de 2023 a agosto de 2023. Foram realizadas análises estatísticas descritivas para caracterização da amostra e análise multivariadas parciais (Partial Least Square PLS - SEM) para verificação do modelo estrutural proposto. Os resultados apresentam uma métrica hierárquica de terceira ordem para o comportamento de cocriação de valor on-line do consumidor, com os fatores de segunda ordem para comportamento participativo, engajamento emocional do consumidor na rede social, engajamento cognitivo do consumidor na rede social e engajamento comportamental do consumidor na rede social. Constatou-se que o comportamento de cocriação de valor on-line é um preditor de intenção de compra on-line em restaurantes no Brasil. O estudo é relevante para a literatura especializada sobre cocriação de valor e engajamento do consumidor, pois oferece à academia e aos gestores de marketing uma validação de um instrumento de análise do comportamento de cocriação de valor on-line do consumidor crucial para a escolha das estratégias mercadológicas. A principal limitação do estudo foi na coleta de dados, devido à concentração de entrevistados na região Sul do Brasil. Destaca-se que a Tese avaliou o comportamento de cocriação de valor no contexto on-line, testou e validou uma métrica de mensuração específica para o contexto virtual.","Abstract: This Doctoral Thesis aimed to verify whether the intention to purchase food online from restaurants in Brazil is positively affected by consumers' online value co-creation behavior. To respond to the aforementioned objective, quantitative research was developed, using a survey technique, with convenience sampling consisting of 606 respondents, from February 2023 to August 2023. Descriptive statistical analyzes were performed to characterize the sample and partial multivariate analysis (Partial Least Square PLS - SEM) to verify the proposed structural model. The results present a third-order hierarchical metric for consumer online value co-creation behavior, with the second-order factors for participatory behavior, consumer emotional social media engagement, consumer cognitive social media engagement, and behavioral engagement of the consumer on the social network. It was found that online value co-creation behavior is a predictor of online purchase intention in restaurants in Brazil. The study is relevant to the specialized literature on value co-creation and consumer engagement, as it offers academia and marketing managers the validation of an instrument for analyzing consumer online value co-creation behavior that is crucial for choosing strategies marketing. The main limitation of the study was data collection, due to the concentration of respondents in the southern region of Brazil. It is noteworthy that the Thesis evaluated value co-creation behavior in the online context, tested and validated a specific measurement metric for the virtual context.",Michele Raasch,Rudimar Antunes da Rocha,2,Tese (Doutorado),https://repositorio.ufsc.br/handle/123456789/253982
2023,Das finanças comportamentais às finanças sociais: análise da suscetibilidade dos investidores à influência interpessoal e seus impactos sobre a tolerância ao risco financeiro e o efeito disposição,"Finanças sociais é um novo paradigma em finanças que busca analisar como as interações sociais afetam os resultados econômicos, reconhecendo que os indivíduos observam uns aos outros e interagem entre si. A influência social que surge dessas interações impacta a tomada de decisão dos indivíduos em seus investimentos, sendo fundamental para compreender como as informações e os sentimentos são transmitidos no mercado de capitais. Ademais, um dos intuitos das finanças sociais é compreender como certos comportamentos dos investidores podem ser motivados pelas interações sociais entre os agentes. Assim, esta pesquisa teve como objetivo principal analisar as relações entre os construtos suscetibilidade dos investidores à influência interpessoal, tolerância ao risco financeiro e efeito disposição. Os objetivos específicos incluíram: construir e validar uma escala para avaliação do nível de suscetibilidade dos investidores à influência interpessoal, considerando como fatores formadores a aprendizagem social e a utilidade social; avaliar os comportamentos de tolerância ao risco financeiro e efeito disposição dos investidores brasileiros; e elaborar um modelo integrado que detectasse os efeitos do nível de suscetibilidade dos investidores à influência interpessoal sobre a tolerância ao risco financeiro e o efeito disposição. Para isso, conduziu-se uma pesquisa tipo survey com 518 investidores individuais de todo o Brasil, que responderam a um questionário estruturado. As técnicas de análise de dados envolveram a análise fatorial exploratória, análise fatorial confirmatória e modelagem de equações estruturais, com a avaliação de duas hipóteses. Em sua maioria, os respondentes da pesquisa eram do sexo masculino, tinham entre 28 e 42 anos, haviam concluído uma pós-graduação e possuíam nível elevado de renda, tendo nenhum ou apenas um dependente. A escala de suscetibilidade dos investidores à influência interpessoal foi validada, sendo composta por cinco itens da dimensão aprendizagem social e sete itens da dimensão utilidade social. Os principais resultados da pesquisa indicaram que os investidores possuíam nível muito baixo de suscetibilidade à influência interpessoal em suas decisões de investimento, sugerindo que são nada ou muito pouco suscetíveis à influência de seus pares quando o assunto é investimentos financeiros. Ademais, a amostra apresentou níveis razoáveis de tolerância ao risco financeiro e de efeito disposição. Quanto ao modelo integrado, identificou-se que a suscetibilidade dos investidores à influência interpessoal impacta de maneira significativa e negativa tanto no nível de tolerância ao risco financeiro quanto de efeito disposição dos indivíduos, o que garantiu a não rejeição das duas hipóteses. O estudo foi capaz de demonstrar que, pelas dimensões da aprendizagem social e da utilidade social, a influência interpessoal pode auxiliar os investidores a reduzirem os níveis de risco em suas decisões financeiras, tendo mais segurança em seus investimentos, e a atenuar preconceitos comportamentais, como aquele relacionado à não negociação de investimentos com valor em queda.","Abstract: Social finance is a new paradigm in finance that aims to analyze how social interactions affect economic outcomes, recognizing that individuals observe and interact with each other. The social influence that arises from these interactions impacts individuals' decision-making in their investments, being fundamental to understand how information and feelings are transmitted in the capital market. Furthermore, one of the purposes of social finance is to understand how certain investor behaviors can be motivated by social interactions between agents. Thus, the main objective of this research was to analyze the relationships between the constructs investors' susceptibility to interpersonal influence, financial risk tolerance and disposition effect. Specific objectives involved: build and validate a scale to assess the level of investors' susceptibility to interpersonal influence, considering social learning and social utility as formative factors; evaluate the financial risk tolerance and disposition effect behaviors of Brazilian investors; and develop an integrated model that would detect the effects of investors' level of susceptibility to interpersonal influence on financial risk tolerance and on the disposition effect. To this end, a survey research was conducted with 518 individual investors from all over Brazil, who responded to a structured questionnaire. Data analysis techniques involved exploratory factor analysis, confirmatory factor analysis and structural equation modeling, with the evaluation of two hypotheses. Most of the survey respondents were male, aged between 28 and 42, had completed a postgraduate degree and had a high level of income, with none or just one dependent. The investors? susceptibility to interpersonal influence scale was validated, consisting of five items from the social learning dimension and seven items from the social utility dimension. The main results of the research indicated that investors had a very low level of susceptibility to interpersonal influence in their investment decisions, suggesting that they are not at all or very little susceptible to the influence of their peers when it comes to financial investments. Furthermore, the sample showed reasonable levels of financial risk tolerance and disposition effect. Regarding the integrated model, it was identified that the investors? susceptibility to interpersonal influence had a significant and negative impact on both the level of financial risk tolerance and the disposition effect of individuals, which guaranteed the non-rejection of the two hypotheses. The study was able to demonstrate that, through the dimensions of social learning and social utility, interpersonal influence can help investors reduce risk levels in their financial decisions, having more security in their investments, and mitigate behavioral prejudices, such as that related to not trading investments with falling value.",Vanessa Martins Valcanover,Newton Carneiro Affonso da Costa Júnior,2,Tese (Doutorado),https://repositorio.ufsc.br/handle/123456789/253975
2023,"Influências social e cultural na experiência do consumidor durante sua jornada de
compra no varejo on-line","À medida que as transações em lojas on-line se tornam cada vez mais prevalentes, observa-se um interesse crescente por parte das empresas em entender como os consumidores conduzem suas compras. Com isso, tem-se uma necessidade de que se identifiquem os antecessores e as consequências da experiência do consumidor durante sua jornada de compra. Assim, o objetivo principal desta tese consiste em analisar os efeitos das influências sociais e culturais na experiência do consumidor durante sua jornada de compra em um contexto de varejo online. A fundamentação apresenta o arcabuço teórico no qual se sustenta a tese, formada por sínteses da literatura sobre a experiência do consumidor; a jornada de compra do consumidor; a influência social no comportamento do consumidor; a influência cultural no comportamento do consumidor; e a apresentação das hipóteses e modelo proposto. Esta pesquisa caracteriza-se como positivista e dedutiva, com método de pesquisa mista sequencial, composta por duas etapas (qualitativa e quantitativa). Os métodos de coleta de dados foram entrevistas em profundidade e levantamento (survey) com horizonte de tempo transversal. A análise dos dados foi feita por meio de análise de conteúdo, estatística descritiva e técnica de Modelagem de Equações Estruturais com modelo de mensuração de mínimos quadrados parciais. Dentre os principais resultados observados, pode-se apontar que: A qualidade da loja on-line e o risco percebido pelo consumidor da loja on-line influenciaram significativamente na sua experiência durante a sua jornada de compra; A experiência do consumidor durante a sua jornada de compra influenciou significativa e certamente a sua satisfação com a loja on-line, a sua intenção de recompra na loja on-line e a geração de eWoM pelo próprio consumidor sobre a loja on-line; A influência social apresenta poder moderador significativo na relação experiência do consumidor e intenção de recompra. A originalidade deste trabalho reside na proposta de um modelo que delineie os fatores antecedentes e consequências da experiência do consumidor, considerando também os potenciais efeitos moderadores da influência social e cultural.","Abstract: As online store transactions become increasingly prevalent, there is a growing interest on the part of companies to understand how consumers conduct their purchases. Consequently, there is a need to identify the antecedents and consequences of the consumer's experience during their buying journey. Thus, the main objective of this thesis is to analyze how social and cultural influences affect the consumer experience during their purchase journey in an online retail context. The foundation presents the theoretical framework on which the thesis is supported, formed by syntheses of literature on the consumer experience; the consumer's purchasing journey; social influence on consumer behavior; the cultural influence on consumer behavior; and the presentation of the hypotheses and proposed model. This research is characterized as positivist and deductive, with a sequential mixed research method, consisting of two stages (qualitative and quantitative). The data collection methods were in-depth interviews and surveys with a transversal time horizon. Data analysis was carried out using content analysis, descriptive statistics and Structural Equation Modeling techniques with a partial least squares measurement model. Among the main results observed, it can be pointed out that: The quality of the online store and the perceived risk by the online store consumer significantly influenced their experience during their buying journey; The consumer's experience during their buying journey significantly and positively influenced their satisfaction with the online store, their intention to repurchase from the online store, and the generation of eWoM (electronic word-of-mouth) by the consumer about the online store; Social influence has a significant moderating power in the relationship between consumer experience and repurchase intention. The originality of this work lies in the proposal of a model that outlines the antecedents and consequences of the consumer experience, also considering the potential moderating effects of social and cultural influence.",João Coelho Soares,Martin de La Martinière Petroll,2,Tese (Doutorado),https://repositorio.ufsc.br/handle/123456789/253959
2023,Os efeitos do human crowding no comportamento dos consumidores em atmosfera de loja: um estudo cross-cultural,"As mudanças devido à pandemia pelo COVID-19 não atingiram somente os varejistas, mas também os consumidores, causando reações no seu comportamento em várias situações e circunstâncias, como por exemplo, do human crowding (aglomeração humana). Nesse caso, o estado psicológico é ativado assim que o indivíduo percebe que as variáveis humanas presentes estão deixando o ambiente lotado ou apertado, podendo então causar reações positivas ou negativas no consumidor e, portanto, influenciar na sua decisão de compra. Sendo assim, a presente dissertação tem como objetivo descrever os efeitos do human crowding no comportamento de consumidores com relação à emoção, satisfação e intenção de compra ao se comparar atmosferas de lojas físicas varejistas com baixa vs alta aglomeração e em culturas individualista (Alemanha) e coletivista (Brasil). Para tanto, optou-se pela pesquisa conclusiva e causal a partir de um experimento on-line between-subjects com 105 consumidores brasileiros e 126 alemães. Os achados do estudo confirmam que o fenômeno do human crowding influencia negativamente nas emoções do consumidor, na sua satisfação e na sua intenção de compra quando ele está diante de um ambiente com alta densidade de human crowding. Com relação à dimensão individualista/coletivista da cultura de Hofstede (2011), esta não apresentou moderação na percepção de human crowding e satisfação, tampouco na intenção de compra. Todavia, o contrário ocorreu na dimensão de aversão à incerteza da cultura de Hofstede (2011), que moderou essas relações. Conclui-se, portanto, que a alta densidade de human crowding tem impacto negativo no comportamento dos consumidores em um ambiente de loja física. Os resultados encontrados na presente dissertação não só ampliam a teoria, mas também oferecem implicações relevantes para as lojas físicas de varejo que enfrentam os desafios de competir com novas formas de varejo e o uso de novas tecnologias. Por fim, destacaram-se algumas limitações do estudo e foram apontadas oportunidades de pesquisas futuras.","Abstract: As a result of the COVID-19 pandemic, there are several types of people, including consumers, who do not respond to this problem in different situations and circumstances, such as human crowding. In this case, the psychological state is activated as soon as the individual realizes that the human variations present are making the environment crowded or cramped, which can then cause positive or negative reactions in the consumer and, therefore, influencing their purchasing decision. Therefore, the present dissertation aims to describe the effects of human crowding on consumer behavior in relation to emotion, satisfaction and purchase intention when comparing restricted physical store atmospheres with low vs. high crowding and in individualistic cultures (Germany) and collectivist (Brazil). To this end, we opted for conclusive and causal research based on an online experiment between subjects with 105 Brazilian and 126 German consumers. The results of the study confirm that the characteristics of human crowding influence the characteristics of consumer emotions, their satisfaction and their purchase intention when they are already in an environment with a high density of human crowding. Regarding Hofstede's (2011) individualist/collectivist dimension of culture, there is no moderation in the perception of human crowding and satisfaction, nor in purchase intention. However, or contrary to Hofstede's (2011) uncertainty avoidance dimension of culture, which moderated these relationships. It is concluded, therefore, that the high density of human crowds has a negative impact on consumer behavior in a physical store environment. The results found in this dissertation do not so much expand a theory, but they also offer relevant implications for physical retail stores that face the challenges of competing with new retail formats and the use of new technologies. Finally, we highlighted some limitations of the study and opportunities for future research were highlighted.",Mariane Rubin Deutschmann,Martin de La Martinière Petroll,1,Dissertação (Mestrado),https://repositorio.ufsc.br/handle/123456789/253733
